{
  "schema": "receipt-verify/registry-record/0",
  "id": "2026-09-16-observation-x402-base-payai-0x9ecf68be",
  "kind": "observation",
  "record_type": "observation",
  "key": {
    "format": "x402.settlement/2",
    "format_version": "2",
    "upstream_digest": {
      "alg": "sha256",
      "value": "0434d308aa5d2fbce614c4831cbf5c37d5a8958ae4098cdb97eb567eabc72d65"
    },
    "verifier": {
      "tool": "@headlessoracle/receipt-verify",
      "version": "0.1.2",
      "commit": "897ddfcddda04e4c79e8676d7db285e87a05c4c9"
    },
    "verified_at": "2026-09-16T10:15:31Z"
  },
  "subject": {
    "implementation": "an x402 exact settlement on Base (eip155:8453), transaction 0x9ecf68be92ca279e6e8874f4ff7bb882da7da05fe8de362967be5ab4d4f6f835, submitted by an address in the signer list PayAI published at https://facilitator.payai.network/supported as that document stood when it was fetched",
    "artefact": "packages/x402-base-payai-0x9ecf68be/, built from public bytes alone: the chain readings from two independently operated endpoints, the discovery transcript, and PayAI's published signer list and OpenAPI as fetched. No 402 object, payment payload or settle answer for this settlement is held by anyone in this package.",
    "artefact_digest": {
      "alg": "sha256",
      "value": "2e3c0ac383ec0f17893281c22c068660b8130496fd12df6946fbc6713ac27e8d"
    },
    "role": "not_applicable",
    "named_party": null
  },
  "assessor": {
    "name": "Michael Msebenzi",
    "affiliation": "Headless Oracle"
  },
  "consent": null,
  "methodology": null,
  "method": "the package's statement.md",
  "executed_run": {
    "command": "receipt-verify --format x402 --json",
    "run_at": "2026-09-16T10:24:48.942Z",
    "tool_commit": "897ddfcddda04e4c79e8676d7db285e87a05c4c9",
    "outputs": [
      {
        "path": "packages/x402-base-payai-0x9ecf68be/verdict.json",
        "sha256": "106f585a79b446e39ad26ff515d9921ebbf2ec4be69a51d6ffd42d8f1a4bab6f",
        "bytes": 3069
      }
    ]
  },
  "pinned_inputs": [
    {
      "path": "packages/x402-base-payai-0x9ecf68be/manifest.json",
      "location": "in_tree",
      "sha256": "0434d308aa5d2fbce614c4831cbf5c37d5a8958ae4098cdb97eb567eabc72d65",
      "bytes": 5430,
      "source": "generated by tools/make-x402-package.ts at 2026-09-16T10:27:05.531Z; it names and digests every other file in the package",
      "retrieved_at": "2026-09-16T10:27:05.531Z",
      "holder": null
    },
    {
      "path": "packages/x402-base-payai-0x9ecf68be/envelope.json",
      "location": "in_tree",
      "sha256": "2e3c0ac383ec0f17893281c22c068660b8130496fd12df6946fbc6713ac27e8d",
      "bytes": 22407,
      "source": "the x402.settlement/2 envelope the verdict was taken over, carrying the chain side only",
      "retrieved_at": "2026-09-16T10:27:05.531Z",
      "holder": null
    },
    {
      "path": "packages/x402-base-payai-0x9ecf68be/chain.json",
      "location": "in_tree",
      "sha256": "7bc78b7078504d6c66337d2848f796ab6e2ff5f7c0580526dcb909bb10bc0f8f",
      "bytes": 56922,
      "source": "both endpoints' raw answers with URLs, read times and per-response digests",
      "retrieved_at": "2026-09-16T10:24:48.942Z",
      "holder": null
    }
  ],
  "as_of": {
    "upstream_digest": {
      "alg": "sha256",
      "value": "0434d308aa5d2fbce614c4831cbf5c37d5a8958ae4098cdb97eb567eabc72d65"
    },
    "date": "2026-09-16"
  },
  "not_established": [
    "What was bought. No 402 object, no payment payload and no settle answer for this settlement is held by anyone in this package, so the resource is unknown, the terms the payee published are unknown, and what the facilitator answered is unknown. verdict.json is UNVERIFIABLE / artefacts_absent for exactly that reason, and its annotations name the three relations that did not run (authorization_signature, authorization_matches_requirements, settle_names_authorization) rather than omitting them, so nothing here can be read as a pass on the half that was present.",
    "Who anyone is. 0xb90c856a... paid and 0xdb5c2df4... was paid; who they are is not in these bytes and no inference about either is made or invited. The submitter is in a list PayAI published, but the list is unsigned, has no validity window, and can change between two reads, so the match is a match against a claim fetched at a time and NOT an identification. The verdict's submitter_list_source annotation says so in those words.",
    "That the resource would have been bound even with the missing artefacts in hand. PayAI's own published OpenAPI, pinned in the package at sha256 4865bc1c9c0903293807c69aca15d6bb33f6632a9115ed52694d89b887b1ab58, requires exactly four members of a SettleResponse (success, transaction, network, payer): there is no signature member in that schema and the resource is not among the four. This is not a defect in PayAI's implementation; it is the shape of x402 v2 exact on EVM, where the buyer's one signature covers {from, to, value, validAfter, validBefore, nonce} and a facilitator cannot bind what the protocol did not give it to bind.",
    "That this observation is a grading of anyone. It is not an entry, no party has consented to be named in it, and it is published as a courtesy to show what a third party can establish from the chain alone and where that stops.",
    "That this record has been independently re-run. It has not; status_label is unverified."
  ],
  "establishes": [
    "That on Base (eip155:8453) transaction 0x9ecf68be92ca279e6e8874f4ff7bb882da7da05fe8de362967be5ab4d4f6f835 succeeded in block 51382192, whose own timestamp is 1789553731 = 2026-09-16T10:15:31Z.",
    "That it carries one USDC (0x833589fCD6eDb6E08f4c7C32D4f71b54bdA02913) Transfer of 100000 atomic units, 0.1 USDC, from 0xb90c856a2edc4b415140b7ee4e3df875180303a3 to 0xdb5c2df47e4a6df74edeb6de3159ae38b8cc10fd, and an EIP-3009 AuthorizationUsed from the same contract naming that same authorizer and nonce 0xf214f06bdbc8dc3e48f73b6596879e01957b9c20cf0513fab6dcf464a15e19e3, so the transfer is an authorization being consumed and that nonce can never be consumed again on that contract.",
    "That the transaction was submitted by 0xb2bd29925cbbcea7628279c91945ca5b98bf371b, which is the second of the fifteen eip155:* signer addresses PayAI published at https://facilitator.payai.network/supported as that document stood when it was fetched at 2026-09-10T12:54Z, sha256 67bfe234984ed0237af2ae281d52907ef9abff7b9d1824fa8284fd225387c072, pinned in the package; and that its transaction went to Multicall3 rather than to the token, so this settlement was batched.",
    "That the block is a block and not a preconfirmation: the block read at height 51382192 carries the block hash the receipt claims for itself, and two independently operated endpoints returned the same chain id, equal receipts and the same block hash.",
    "That the method by which the settlement was found is itself checkable and is carried in full: eth_getLogs against USDC for topic0 keccak(\"AuthorizationUsed(address,bytes32)\") over blocks 51381946 to 51382346, a window ending 64 blocks behind the tip at read time, then eth_getTransactionByHash per candidate, newest first, until a sender in the published set; the discovery response was re-fetched three minutes later and is byte-identical at 503684 bytes and the same sha256."
  ],
  "independent_rerun": null,
  "review_window": null,
  "reply": {
    "kind": "none",
    "date": null,
    "pointer": null,
    "text_sha256": null
  },
  "status": "published",
  "supersedes": null,
  "superseded_by": null,
  "supersession_reason": null,
  "report": {
    "path": "packages/x402-base-payai-0x9ecf68be/statement.md",
    "sha256": "ba1b62c2284ea424982fbabd01970ab0858a110235bf6f24db73f5138664c2ae",
    "bytes": 5628
  }
}
