{
  "schema": "receipt-verify/registry-record/0",
  "id": "2026-09-07-x402-settlement-base-0x94bfba79",
  "kind": "own_work",
  "record_type": "dispute_package",
  "key": {
    "format": "x402.settlement/2",
    "format_version": "2",
    "upstream_digest": {
      "alg": "sha256",
      "value": "f8f1d25d524416c3c87c8fe51b0a86a444bc7bc00ed50fef106f3e908efd9832"
    },
    "verifier": {
      "tool": "@headlessoracle/receipt-verify",
      "version": "0.1.2",
      "commit": "1368e0dfef79fd9f1ba2e0e383676649e4b0717b"
    },
    "verified_at": "2026-09-07"
  },
  "subject": {
    "implementation": "the x402 exact settlement path on Base (eip155:8453), transaction 0x94bfba79903d560e54bf0bf79c347d54d057357fb3389ab9dfd76e44d0bdbdd1",
    "artefact": "packages/x402-base-2026-09-07-0x94bfba79/, the signed evidence package: the 402 object, the payment payload, the settle answer, the delivered paid response, the envelope, the verdict and both endpoints' chain readings",
    "artefact_digest": {
      "alg": "sha256",
      "value": "21fd0597192e9796d0f646b023d421d4e99a44b12778c6daa148881ee3fd6799"
    },
    "role": "payer",
    "named_party": "Michael Msebenzi"
  },
  "assessor": {
    "name": "Michael Msebenzi",
    "affiliation": "Headless Oracle"
  },
  "consent": {
    "named_human": "Michael Msebenzi",
    "affiliation": "Headless Oracle",
    "given_on": "2026-09-11",
    "channel": "ruling on CC_HANDOFF_2026-09-15_registry.md",
    "scope": "own work"
  },
  "methodology": null,
  "method": "README, Format 5 (x402.settlement/2), and the package's statement.md",
  "executed_run": {
    "command": "receipt-verify --format x402 --json",
    "run_at": "2026-09-16T10:05:21.845Z",
    "tool_commit": "1368e0dfef79fd9f1ba2e0e383676649e4b0717b",
    "outputs": [
      {
        "path": "packages/x402-base-2026-09-07-0x94bfba79/verdict.json",
        "sha256": "6c74bd458e153d46dc0655d6b60420a59f7128d6c9ffeb85b34da7ade3603449",
        "bytes": 3955
      }
    ]
  },
  "pinned_inputs": [
    {
      "path": "packages/x402-base-2026-09-07-0x94bfba79/manifest.json",
      "location": "in_tree",
      "sha256": "f8f1d25d524416c3c87c8fe51b0a86a444bc7bc00ed50fef106f3e908efd9832",
      "bytes": 4989,
      "source": "generated by tools/make-x402-package.ts at 2026-09-16T10:17:18.622Z; it names and digests every other file in the package",
      "retrieved_at": "2026-09-16T10:17:18.622Z",
      "holder": null
    },
    {
      "path": "packages/x402-base-2026-09-07-0x94bfba79/envelope.json",
      "location": "in_tree",
      "sha256": "21fd0597192e9796d0f646b023d421d4e99a44b12778c6daa148881ee3fd6799",
      "bytes": 30009,
      "source": "the x402.settlement/2 envelope the verdict was taken over",
      "retrieved_at": "2026-09-16T10:17:18.622Z",
      "holder": null
    },
    {
      "path": "packages/x402-base-2026-09-07-0x94bfba79/chain.json",
      "location": "in_tree",
      "sha256": "d89e598e070836dc77dff541fcaca609b2997dd8cae01b17f432e553849ac0f2",
      "bytes": 86617,
      "source": "both endpoints' raw answers with URLs, read times and per-response digests",
      "retrieved_at": "2026-09-16T10:05:21.845Z",
      "holder": null
    }
  ],
  "as_of": {
    "upstream_digest": {
      "alg": "sha256",
      "value": "f8f1d25d524416c3c87c8fe51b0a86a444bc7bc00ed50fef106f3e908efd9832"
    },
    "date": "2026-09-16"
  },
  "not_established": [
    "That the delivered bytes are bound to the payment. This package holds the paid 200's body, artefacts/paid-receipt.json: our own signed market-state receipt, issued at 2026-09-07T16:37:32.817Z for XNYS, CLOSED, signed under key_2026_v1. It carries NO settlement member: no transaction hash, no payer, no nonce, no reference to the payment at all. A holder of this package can verify that the money moved and that a receipt was issued, and cannot show from signatures alone that the one was issued for the other; the only tie is that both sit in this directory with instants three seconds apart. This is a finding against our own work, tracked as B-81, and it is open.",
    "What was bought. The single EIP-3009 signature covers six values and the resource is not among them; the 402 object, the payload's resource and accepted members and the settle answer are unsigned text beside it. That is limit_resource_binding: unsigned on this VALID result, and resource_binding in its coverage block.",
    "Who the submitter is. 0xe74817f4cdc15844314812b2271276e64e890fae is recorded because the chain records it; nothing here says who operates that address, and no facilitator signer list was supplied. That is limit_facilitator_identity: unsigned_list.",
    "That the chain answers are the chain's. Two independently operated endpoints were read and agreed and the block is at height, which is two parties rather than one, not zero. That is limit_rpc_trust: verifier_choice.",
    "That this record has been independently re-run. It has not; status_label is unverified, and the assessor operates the payer account, the resource server and the verifier."
  ],
  "establishes": [
    "That 0x13bf013EDb5c8bbA2747b06031bcDbb6C5173F63 signed an EIP-3009 TransferWithAuthorization for 1000 atomic units of USDC on Base to 0x26D4Ffe98017D2f160E2dAaE9d119e3d8b860AD3, that the signature recovers that address under the EIP-712 domain the 402 object's own members name, and that those terms are the terms the server published.",
    "That the settle answer names the same payer, the same network and transaction 0x94bfba79903d560e54bf0bf79c347d54d057357fb3389ab9dfd76e44d0bdbdd1, and that the transaction succeeded on Base at block 51004854, whose own timestamp is 1788799055 = 2026-09-07T16:37:35Z.",
    "That the block carries exactly one USDC Transfer from the payer to the payee for exactly 1000 atomic units and an AuthorizationUsed naming the same authorizer and nonce, so the transfer is that authorization being consumed, and that the block at that height carries the block hash the receipt claims.",
    "That a paid response was delivered and is carried here, and that it names no settlement. That absence is itself the finding: it is established by the bytes, not inferred from their lack.",
    "That the verifier's own output for these bytes is VALID / verified, exit code 0, stopped_at null and no checks left unevaluated."
  ],
  "independent_rerun": null,
  "review_window": null,
  "reply": {
    "kind": "none",
    "date": null,
    "pointer": null,
    "text_sha256": null
  },
  "status": "published",
  "supersedes": null,
  "superseded_by": null,
  "supersession_reason": null,
  "report": {
    "path": "packages/x402-base-2026-09-07-0x94bfba79/statement.md",
    "sha256": "217e179fc28a0af8c720421994f51c20870d59f6182ad4ba77312203a79ce41f",
    "bytes": 3965
  }
}
